{"additional_five_days":"TRUSTED_VERBATIM_NO_MATURITY_WAIT","content_audit_deferred_until":"T04_RECIPE_LOCK_AND_OWNER_T05_REPLAY","future_holdout_audit":"CLI_AND_CF6_UNANIMITY_OR_EXACT_FROZEN_GUARDED_EXCEPTION","holdout_access":"CLOSED","query_truth_requires_committed_forecast":true,"schema_version":"R14_TABULAR_TRUTH_ADAPTER_V1","training_cutoff":"target_date < update_date - 7 calendar days","truth_imputation":false}
